{
  "$schema": "http://json-schema.org/draft-07/schema#",
  "type": "array",
  "items": {
    "type": "object",
    "properties": {
      "Id": { "type": "string" },
      "Title": { "type": "string" },
      "Description": { "type": "string" },
      "Ingredients": {
        "type": "array",
        "items": { "type": "string" }
      },
      "Instructions": {
        "type": "array",
        "items": { "type": "string" }
      },
      "PrepTime": { "type": "string" },
      "Image": { "type": "string" },
      "Tags": {
        "type": "array",
        "items": { "type": "string" }
      }
    },
    "required": ["Id", "Title", "Description", "Ingredients", "Instructions", "PrepTime", "Image", "Tags"]
  }
}
